dataset,rid,title,p_main,lex_score,lex_rank_pct
Muthu_2021,https://openalex.org/W2085626304,Safety of balloon kyphoplasty in the treatment of osteoporotic vertebral compression fractures in Europe: a meta-analysi,0.0,0.023916686866563275,0.8256712026480324
Muthu_2021,https://openalex.org/W2081494650,Randomized Clinical Study to Compare the Accuracy of Navigated and Non-Navigated Thoracic Pedicle Screws in Deformity Co,0.0,0.06595259234774666,0.10334681868333946
Muthu_2021,https://openalex.org/W2424326616,Anterior cervical discectomy and fusion (ACDF) versus cervical disc arthroplasty (CDA) for two contiguous levels cervica,0.0,0.06832099738702054,0.0831187936741449
Muthu_2021,https://openalex.org/W2011922368,Comparison of artificial total disc replacement versus fusion for lumbar degenerative disc disease: a meta-analysis of r,0.0,0.06576588625145877,0.1044501655020228
Moran_2021,https://openalex.org/W2895967873,"Environmental variability, the value of information, and learning in winter residents",0.0008099449291661308,0.011939509454649904,0.6705135603000577
Moran_2021,https://openalex.org/W2896861612,Effectiveness of interventions aimed at improving dietary behaviours among people at higher risk of or with chronic non-,0.0,0.032539297954836094,0.15849201769571072
Moran_2021,https://openalex.org/W2903635703,A Meta-Analysis of Food Labeling Effects on Consumer Diet Behaviors and Industry Practices,0.0,0.022272530184092296,0.3216003077514907
Moran_2021,https://openalex.org/W2136823874,Systematic review of sedentary behaviour and health indicators in school-aged children and youth,0.0,0.03710474758762563,0.11598384304673975
Hall_2012,https://openalex.org/W2120484483,Software defect association mining and defect correction effort prediction,0.0,0.06928144263659046,0.016831570567496873
